{
  "$schema": "https://json-schema.org/draft/2020-12/schema",
  "$id": "https://marcorzzn.github.io/Mathema/schema/node.schema.json",
  "title": "mathema Knowledge Node Schema (Frozen Contract — Phase C)",
  "description": "Contratto dati congelato per un nodo della conoscenza matematica in mathema. I codici a 2, 3 e 5 caratteri (es. 11, 11J, 11J72) appartengono allo standard ufficiale MSC2020. I suffissi con punto (es. 11J72.1, 11J72.1.2, 11J72.1.2.a) sono l'estensione gerarchica di mathema.",
  "type": "object",
  "required": [
    "id",
    "msc",
    "kind",
    "title",
    "natural",
    "symbolic",
    "lean",
    "missing",
    "deps",
    "children",
    "steps",
    "attachments",
    "sources",
    "formalization_yaml",
    "license",
    "provenance",
    "reviewed_by"
  ],
  "properties": {
    "id": {
      "type": "string",
      "pattern": "^[0-9]{2}[A-Z][0-9]{2}\\.[0-9A-Za-z.]+$",
      "description": "Codice univoco gerarchico esteso mathema (es. 11J72.1). Non fa parte dello standard MSC2020 ma estende una voce MSC a 5 caratteri."
    },
    "msc": {
      "type": "string",
      "pattern": "^[0-9]{2}[A-Z][0-9]{2}$",
      "description": "Codice ufficiale MSC2020 a 5 caratteri a cui appartiene il nodo (es. 11J72)."
    },
    "kind": {
      "type": "string",
      "enum": [
        "definition",
        "lemma",
        "theorem",
        "corollary",
        "proof",
        "technique",
        "example",
        "exercise",
        "remark"
      ],
      "description": "Ruolo logico-matematico del nodo."
    },
    "title": {
      "type": "object",
      "minProperties": 2,
      "additionalProperties": { "type": "string", "minLength": 1 },
      "required": ["it", "en"],
      "description": "Titolo del nodo nelle lingue supportate (almeno it e en obbligatorie)."
    },
    "natural": {
      "type": "object",
      "minProperties": 2,
      "additionalProperties": { "type": "string", "minLength": 1 },
      "required": ["it", "en"],
      "description": "Rappresentazione 1/3: Enunciato o spiegazione in linguaggio naturale multilingue."
    },
    "symbolic": {
      "type": "string",
      "minLength": 1,
      "description": "Rappresentazione 2/3: Sintassi simbolica formale (notazione matematica Unicode / LaTeX leggero)."
    },
    "lean": {
      "$ref": "#/$defs/leanBlock"
    },
    "missing": {
      "type": "array",
      "items": { "type": "string" },
      "description": "Invariante I2: Lista esplicita di elementi o traduzioni non ancora presenti nel nodo (es. ['lean_proof', 'lang:hi']). Se tutto è presente, array vuoto []."
    },
    "deps": {
      "type": "array",
      "items": {
        "$ref": "#/$defs/dependency"
      },
      "description": "Dipendenze logiche verso altri nodi o passaggi."
    },
    "children": {
      "type": "array",
      "items": { "type": "string" },
      "description": "Lista ordinata dei codici dei nodi o passaggi figli diretti."
    },
    "steps": {
      "type": "array",
      "items": {
        "$ref": "#/$defs/stepNode"
      },
      "description": "Passaggi dimostrativi e micro-risultati annidati appartenenti a questo nodo."
    },
    "attachments": {
      "type": "array",
      "minItems": 1,
      "items": {
        "$ref": "#/$defs/attachment"
      },
      "description": "Fase B: Almeno 1 allegato (figura SVG, grafico 2D o scena 3D lazy) per ogni nodo principale."
    },
    "sources": {
      "type": "array",
      "minItems": 1,
      "items": {
        "type": "object",
        "required": ["title", "citation", "license_note"],
        "properties": {
          "title": { "type": "string" },
          "citation": { "type": "string" },
          "url": { "type": "string" },
          "license_note": { "type": "string" }
        }
      },
      "description": "Fonti bibliografiche o formali con indicazione della compatibilità di licenza."
    },
    "formalization_yaml": {
      "$ref": "#/$defs/palomarBlock"
    },
    "license": {
      "type": "string",
      "enum": ["CC-BY-SA-4.0", "Apache-2.0"],
      "description": "Licenza del nodo (CC-BY-SA-4.0 per i testi, Apache-2.0 per il codice formale)."
    },
    "provenance": {
      "type": "string",
      "enum": ["human", "ai-assisted", "imported"],
      "description": "Origine del contenuto."
    },
    "reviewed_by": {
      "type": "array",
      "minItems": 1,
      "items": { "type": "string" },
      "description": "Revisori umani che hanno controllato la correttezza matematica del nodo."
    }
  },
  "$defs": {
    "leanBlock": {
      "type": "object",
      "required": ["code", "hash", "status", "mathlib_version", "mathlib_name", "verified_at"],
      "properties": {
        "code": {
          "type": "string",
          "description": "Rappresentazione 3/3: Codice formale Lean 4 allineato a Mathlib."
        },
        "hash": {
          "type": "string",
          "pattern": "^[a-f0-9]{64}$",
          "description": "Fase C / Invariante I1: Hash SHA-256 del codice Lean (lean.code.trim()) per rilevare modifiche al JSON successive a lake build."
        },
        "file_hash": {
          "type": ["string", "null"],
          "description": "Fase C / Invariante I1: Hash SHA-256 del file sorgente .lean nel progetto Lake al momento della verifica."
        },
        "status": {
          "type": "string",
          "enum": ["none", "statement_only", "has_sorry", "unverified", "compiled"],
          "description": "Invariante I1: Stato ONESTO di verifica Lean. 'unverified' è il default per codice senza sorry. 'compiled' è ammesso SOLO se esiste il binario .olean generato da lake build e gli hash coincidono."
        },
        "mathlib_version": {
          "type": "string",
          "description": "Versione di Mathlib4 di riferimento (es. v4.15.0)."
        },
        "mathlib_name": {
          "type": "string",
          "description": "Invariante I8: Identificatore verificato in Mathlib4 oppure 'none' se non presente in Mathlib."
        },
        "lean_file": {
          "type": "string",
          "description": "Percorso del file nel progetto Lake (es. lean/Mathema/NumberTheory/Sqrt2.lean)."
        },
        "verified_at": {
          "type": ["string", "null"],
          "description": "Data ISO-8601 dell'ultima compilazione riuscita con lake build, o null se non compilato."
        }
      }
    },
    "palomarBlock": {
      "type": "object",
      "required": ["project", "msc", "target_theorem", "comparator_setup"],
      "properties": {
        "project": { "type": "string" },
        "msc": { "type": "string" },
        "target_theorem": { "type": "string" },
        "comparator_setup": {
          "type": "object",
          "required": ["lean_toolchain", "mathlib_rev", "permitted_axioms"],
          "properties": {
            "lean_toolchain": { "type": "string" },
            "mathlib_rev": { "type": "string" },
            "permitted_axioms": {
              "type": "array",
              "items": { "type": "string" }
            }
          }
        }
      },
      "description": "Metadati compatibili con lo standard Palomar (formalization.yaml + Comparator)."
    },
    "dependency": {
      "type": "object",
      "required": ["id", "type"],
      "properties": {
        "id": {
          "type": "string",
          "description": "Codice del nodo o passaggio da cui si dipende."
        },
        "type": {
          "type": "string",
          "enum": [
            "requires",
            "generalizes",
            "special_case_of",
            "alternative_proof_of",
            "applies_to"
          ]
        }
      }
    },
    "stepNode": {
      "type": "object",
      "required": ["id", "kind", "title", "natural", "symbolic", "lean", "missing", "deps"],
      "properties": {
        "id": { "type": "string" },
        "kind": {
          "type": "string",
          "enum": ["lemma", "proof", "technique", "remark", "corollary"]
        },
        "title": {
          "type": "object",
          "required": ["it", "en"],
          "additionalProperties": { "type": "string" }
        },
        "natural": {
          "type": "object",
          "required": ["it", "en"],
          "additionalProperties": { "type": "string" }
        },
        "symbolic": { "type": "string" },
        "lean": { "$ref": "#/$defs/leanBlock" },
        "missing": {
          "type": "array",
          "items": { "type": "string" }
        },
        "deps": {
          "type": "array",
          "items": { "$ref": "#/$defs/dependency" }
        },
        "substeps": {
          "type": "array",
          "items": { "$ref": "#/$defs/stepNode" }
        }
      }
    },
    "attachment": {
      "type": "object",
      "required": ["id", "kind", "title", "caption"],
      "properties": {
        "id": { "type": "string" },
        "kind": {
          "type": "string",
          "enum": ["svg", "plot2d", "scene3d"]
        },
        "title": {
          "type": "object",
          "required": ["it", "en"],
          "additionalProperties": { "type": "string" }
        },
        "caption": {
          "type": "object",
          "required": ["it", "en"],
          "additionalProperties": { "type": "string" }
        },
        "svg": {
          "type": "string",
          "description": "Markup SVG inline minimale per figure geometriche o diagrammi."
        },
        "preset": {
          "type": "string",
          "description": "Identificatore del grafico 2D o scena 3D caricata su richiesta."
        }
      }
    }
  }
}
