{
  "id": "11A51.0",
  "msc": "11A51",
  "kind": "lemma",
  "title": {
    "it": "Lemma di Euclide (Elementi VII.30): se p primo divide a·b, allora p divide a oppure p divide b",
    "en": "Euclid's Lemma (Elements VII.30): if a prime p divides a·b, then p divides a or p divides b",
    "es": "Lema de Euclides (Elementos VII.30): si p primo divide a a·b, entonces p divide a a o a b",
    "ar": "تمهيدية إقليدس (الأصول VII.30): إذا قسم عدد أولي p الجداء a·b فإنه يقسم a أو يقسم b"
  },
  "natural": {
    "it": "Sia p ∈ ℕ un numero primo e siano a, b ∈ ℕ. Se p divide il prodotto a·b, allora p divide a oppure p divide b. Ciò equivale a dire che in ℕ ogni elemento irriducibile è primo.",
    "en": "Let p ∈ ℕ be a prime number and let a, b ∈ ℕ. If p divides the product a·b, then p divides a or p divides b. Equivalently, in ℕ every irreducible element is prime.",
    "es": "Sea p ∈ ℕ un número primo y a, b ∈ ℕ. Si p divide a a·b, entonces p divide a a o p divide a b.",
    "ar": "ليكن p عدداً أولياً و a, b عددين طبيعيين. إذا كان p يقسم الجداء a·b فإن p يقسم a أو يقسم b."
  },
  "symbolic": "∀ p, a, b ∈ ℕ : Prime(p) ∧ p ∣ a·b  ⇒  p ∣ a ∨ p ∣ b",
  "lean": {
    "code": "import Mathlib.Data.Nat.Prime.Basic\n\ntheorem mathema_euclid_lemma {p a b : ℕ} (hp : p.Prime) (h : p ∣ a * b) :\n    p ∣ a ∨ p ∣ b :=\n  hp.dvd_mul.mp h",
    "status": "compiled",
    "mathlib_version": "v4.15.0",
    "mathlib_name": "Nat.Prime.dvd_mul",
    "lean_file": "lean/Mathema/NumberTheory/FundamentalArithmetic.lean",
    "verified_at": "2026-10-26T17:03:17.143Z",
    "hash": "ea951b3bf6dd56793dfe8e0997f615d69ec47266bc97209d2806e68a902f77f9",
    "file_hash": "9517b1fbe7b62c49f25036ef8c741f632d6d81789bf7bb28677fb80a693a4e3f"
  },
  "deps": [
    {
      "id": "11A41.0",
      "type": "requires"
    }
  ],
  "children": [
    "11A51.0.1",
    "11A51.0.2"
  ],
  "steps": [
    {
      "id": "11A51.0.1",
      "kind": "lemma",
      "title": {
        "it": "Dicotomia di coprimalità per un primo p: p ∣ a oppure MCD(p, a) = 1",
        "en": "Coprimality dichotomy for a prime p: p ∣ a or gcd(p, a) = 1",
        "es": "Dicotomía de coprimalidad: p ∣ a o mcd(p, a) = 1",
        "ar": "ثنائية الأولية النسبية: إما p ∣ a أو gcd(p, a) = 1"
      },
      "natural": {
        "it": "Poiché MCD(p, a) divide p e gli unici divisori positivi del primo p sono 1 e p, si ha MCD(p, a) = p (ossia p ∣ a) oppure MCD(p, a) = 1 (p e a sono coprimi).",
        "en": "Since gcd(p, a) divides p and the only positive divisors of the prime p are 1 and p, either gcd(p, a) = p (so p ∣ a) or gcd(p, a) = 1 (p and a are coprime).",
        "es": "Como mcd(p, a) divide a p, o bien mcd(p, a) = p (p ∣ a) o bien mcd(p, a) = 1.",
        "ar": "بما أن القاسم المشترك الأكبر gcd(p, a) يقسم العدد الأولي p، فإما أن يكون p (أي p ∣ a) أو 1."
      },
      "symbolic": "Prime(p)  ⇒  (p ∣ a  ∨  gcd(p, a) = 1)",
      "lean": {
        "code": "example {p a : ℕ} (hp : p.Prime) : p ∣ a ∨ p.Coprime a := by\n  rw [hp.coprime_iff_not_dvd]\n  exact Classical.em (p ∣ a)",
        "status": "compiled",
        "mathlib_version": "v4.15.0",
        "mathlib_name": "Nat.Prime.coprime_iff_not_dvd",
        "lean_file": "lean/Mathema/NumberTheory/FundamentalArithmetic.lean",
        "verified_at": "2026-10-26T17:03:17.143Z",
        "hash": "8000e67cc8005f6fd4ef31a2d1dc78cb5852e43aec1c35abcbf756013fedb2b8",
        "file_hash": "9517b1fbe7b62c49f25036ef8c741f632d6d81789bf7bb28677fb80a693a4e3f"
      },
      "deps": [
        {
          "id": "11A41.0",
          "type": "requires"
        }
      ],
      "substeps": [
        {
          "id": "11A51.0.1.a",
          "kind": "lemma",
          "title": {
            "it": "Micro-risultato: Identità di Bézout u·p + v·a = 1",
            "en": "Micro-result: Bézout's identity u·p + v·a = 1",
            "es": "Microrresultado: Identidad de Bézout u·p + v·a = 1",
            "ar": "نتيجة جزئية: متطابقة بيزو u·p + v·a = 1"
          },
          "natural": {
            "it": "Se MCD(p, a) = 1, per il teorema di Bézout in ℤ esistono due interi u, v ∈ ℤ tali che u·p + v·a = 1.",
            "en": "If gcd(p, a) = 1, by Bézout's theorem in ℤ there exist integers u, v ∈ ℤ such that u·p + v·a = 1.",
            "es": "Si mcd(p, a) = 1, existen u, v ∈ ℤ tales que u·p + v·a = 1.",
            "ar": "إذا كان gcd(p, a) = 1 فإنه يوجد عددان صحيحان u, v يحققان u·p + v·a = 1."
          },
          "symbolic": "gcd(p, a) = 1  ⇒  ∃ u, v ∈ ℤ : u·p + v·a = 1",
          "lean": {
            "code": "#check Nat.gcd_eq_gcd_ab",
            "status": "statement_only",
            "mathlib_version": "v4.15.0",
            "mathlib_name": "Nat.gcd_eq_gcd_ab",
            "lean_file": "lean/Mathema/NumberTheory/FundamentalArithmetic.lean",
            "verified_at": null,
            "hash": "4fae6b4c03f5eaeb0597ebb0a21e7e1a9654292735a2262771eed4a753237cac",
            "file_hash": "9517b1fbe7b62c49f25036ef8c741f632d6d81789bf7bb28677fb80a693a4e3f"
          },
          "deps": [],
          "missing": [
            "lang:fr",
            "lang:de",
            "lang:pt",
            "lang:zh",
            "lang:hi",
            "lang:ru",
            "lean:local_proof"
          ]
        }
      ],
      "missing": [
        "lang:fr",
        "lang:de",
        "lang:pt",
        "lang:zh",
        "lang:hi",
        "lang:ru"
      ]
    },
    {
      "id": "11A51.0.2",
      "kind": "proof",
      "title": {
        "it": "Moltiplicazione per b dell'identità di Bézout",
        "en": "Multiplying Bézout's identity by b",
        "es": "Multiplicación por b de la identidad de Bézout",
        "ar": "ضرب متطابقة بيزو بالعدد b"
      },
      "natural": {
        "it": "Se ¬(p ∣ a), allora u·p + v·a = 1. Moltiplicando per b otteniamo u·p·b + v·(a·b) = b. Poiché p divide sia u·p·b sia v·(a·b) per ipotesi, p divide la loro somma b.",
        "en": "If ¬(p ∣ a), then u·p + v·a = 1. Multiplying by b gives u·p·b + v·(a·b) = b. Since p divides both u·p·b and v·(a·b), p divides their sum b.",
        "es": "Multiplicando u·p + v·a = 1 por b resulta u·p·b + v·(a·b) = b; como p divide a ambos sumandos, p divide a b.",
        "ar": "بضرب العلاقة u·p + v·a = 1 في b نحصل على u·p·b + v·(a·b) = b، وبما أن p يقسم الحدين فإنه يقسم b."
      },
      "symbolic": "b = p·(u·b) + v·(a·b)  ∧  p ∣ a·b  ⇒  p ∣ b",
      "lean": {
        "code": "theorem dvd_of_coprime_of_dvd_mul {p a b : ℕ} (hcop : p.Coprime a) (hdvd : p ∣ a * b) :\n    p ∣ b :=\n  hcop.dvd_of_dvd_mul_left hdvd",
        "status": "compiled",
        "mathlib_version": "v4.15.0",
        "mathlib_name": "Nat.Coprime.dvd_of_dvd_mul_left",
        "lean_file": "lean/Mathema/NumberTheory/FundamentalArithmetic.lean",
        "verified_at": "2026-10-26T17:03:17.143Z",
        "hash": "c9eac324a38026f8f0e8e98d3ff43d1479d5b44303d7a3faa0223403fcb7dedf",
        "file_hash": "9517b1fbe7b62c49f25036ef8c741f632d6d81789bf7bb28677fb80a693a4e3f"
      },
      "deps": [
        {
          "id": "11A51.0.1",
          "type": "requires"
        },
        {
          "id": "11A51.0.1.a",
          "type": "requires"
        }
      ],
      "missing": [
        "lang:fr",
        "lang:de",
        "lang:pt",
        "lang:zh",
        "lang:hi",
        "lang:ru"
      ]
    }
  ],
  "attachments": [
    {
      "id": "11A51.0.fig1",
      "kind": "svg",
      "title": {
        "it": "Figura 1: Dall'identità di Bézout u·p + v·a = 1 al Lemma di Euclide",
        "en": "Figure 1: From Bézout's identity u·p + v·a = 1 to Euclid's Lemma"
      },
      "caption": {
        "it": "Se p ∤ a allora gcd(p, a) = 1; moltiplicando u·p + v·a = 1 per b si ottiene che p divide b.",
        "en": "If p ∤ a then gcd(p, a) = 1; multiplying u·p + v·a = 1 by b shows that p divides b."
      },
      "svg": "<svg viewBox=\"0 0 430 115\" width=\"430\" height=\"115\" role=\"img\" aria-label=\"Schema del Lemma di Euclide\"><rect x=\"14\" y=\"18\" width=\"175\" height=\"42\" rx=\"3\"/><text x=\"24\" y=\"44\">gcd(p, a) = 1 ⇒ up + va = 1</text><line x1=\"189\" y1=\"39\" x2=\"225\" y2=\"39\" stroke=\"currentColor\"/><rect x=\"225\" y=\"18\" width=\"190\" height=\"42\" rx=\"3\"/><text x=\"235\" y=\"44\">b = p·(ub) + v·(ab)</text><text x=\"20\" y=\"90\">Poiché p ∣ p·(ub) e per ipotesi p ∣ ab, segue necessariamente p ∣ b.</text></svg>"
    }
  ],
  "sources": [
    {
      "title": "Euclide, Elementi, Libro VII, Proposizione 30",
      "citation": "Lemma fondamentale sulla divisibilità per un numero primo (pubblico dominio)",
      "license_note": "Pubblico dominio → testo CC-BY-SA-4.0"
    }
  ],
  "license": "CC-BY-SA-4.0",
  "provenance": "human",
  "reviewed_by": [
    "Marco Razzano"
  ],
  "formalization_yaml": {
    "project": "mathema",
    "msc": "11A51",
    "target_theorem": "Nat.Prime.dvd_mul",
    "comparator_setup": {
      "lean_toolchain": "leanprover/lean4:v4.15.0",
      "mathlib_rev": "v4.15.0",
      "permitted_axioms": [
        "propext",
        "Classical.choice",
        "Quot.sound"
      ]
    }
  },
  "missing": [
    "lang:fr",
    "lang:de",
    "lang:pt",
    "lang:zh",
    "lang:hi",
    "lang:ru"
  ]
}
